contact_id,contact_name,institution,bounced_email,bounce_diagnosis,verification_result,recommended_action,candidate_contact,candidate_channel,source_url,notes
agora-legacy-029,Luis Fernando Gutierrez Cano,UPB,luisfe.gutierrezcano@upb.edu.co,550 5.4.1,correo alternativo institucional encontrado,preparar reenvio manual revisado,luisfe.gutierrez@upb.edu.co,email,https://repository.upb.edu.co/bitstream/handle/20.500.11912/8688/GT10.%20Comunicaci%C3%B3n%2C%20tecnolog%C3%ADa%20y%20desarrollo.pdf?isAllowed=y&sequence=37,El correo publicado en fuente UPB omite el apellido cano.
agora-legacy-052,Zsofia Varga,Javeriana,varga@javeriana.edu.co,554 5.4.14 Hop count exceeded - possible mail loop,correo original sigue publicado oficialmente,no reenviar hasta confirmar que el mail loop de Javeriana ceso; si persiste usar coordinacion del Centro de Escritura,"varga@javeriana.edu.co; backup: va.solano@javeriana.edu.co",email,https://comunicacionylenguaje.javeriana.edu.co/web/facultad-comunicacion-lenguaje/centro-de-escritura,El rebote apunta a infraestructura de correo no a direccion inexistente.
agora-legacy-056,Maria Alejandra Lopez Arias,Javeriana,m.lopeza01@javeriana.edu.co,554 5.4.14 Hop count exceeded - possible mail loop,correo original sigue publicado oficialmente,no reenviar hasta confirmar que el mail loop de Javeriana ceso; si persiste usar coordinacion del Centro de Escritura,"m.lopeza01@javeriana.edu.co; backup: va.solano@javeriana.edu.co",email,https://comunicacionylenguaje.javeriana.edu.co/web/facultad-comunicacion-lenguaje/centro-de-escritura,El rebote apunta a infraestructura de correo no a direccion inexistente.
agora-legacy-059,Maximoni Lopez,Javeriana,maximoni.lopez@javeriana.edu.co,554 5.4.14 Hop count exceeded - possible mail loop,correo original aparece publicado oficialmente,no reenviar hasta confirmar que el mail loop de Javeriana ceso; si persiste usar tutoras del semillero,"maximoni.lopez@javeriana.edu.co; backup: ibermejo@javeriana.edu.co; va.solano@javeriana.edu.co",email,https://comunicacionylenguaje.javeriana.edu.co/inicio/-/asset_publisher/dr4nHq6VZ5Kk/content/id/1670610,El rebote apunta a infraestructura de correo no a direccion inexistente.
agora-legacy-072,Semillero Subjetividad,Javeriana,semillerosubjetividad@javeriana.edu.co,554 5.4.14 Hop count exceeded - possible mail loop,correo original y tutoras aparecen publicados oficialmente,no reenviar hasta confirmar que el mail loop de Javeriana ceso; si persiste usar tutoras del semillero,"semillerosubjetividad@javeriana.edu.co; backup: ibermejo@javeriana.edu.co; va.solano@javeriana.edu.co",email,https://comunicacionylenguaje.javeriana.edu.co/inicio/-/asset_publisher/dr4nHq6VZ5Kk/content/id/1670610,El rebote apunta a infraestructura de correo no a direccion inexistente.
agora-legacy-099,Jesus Anturi Perdomo,Uninorte,arturij@uninorte.edu.co,550 5.4.1,correo original sigue publicado en directorio,no reenviar por email hasta revisar entregabilidad; usar canal manual o extension publicada,"arturij@uninorte.edu.co; ext 4634",email/manual,https://www.uninorte.edu.co/web/comunicaciones/inicio,El directorio confirma el correo; el rebote puede ser rechazo del servidor receptor.
agora-legacy-124,Maria Emilia Montes,UNAL Bogota,memontesro@unal.edu.co,Address not found,correo alternativo institucional encontrado,preparar reenvio manual revisado,memontesr@unal.edu.co,email,https://www.humanas.unal.edu.co/2017/unidades-academicas/departamentos/linguistica/programas/maestria/equipo,La variante oficial publicada no incluye la letra o final.
agora-legacy-289,Pablo Munoz Specht,UNAL Bogota,pmunozs@unal.edu.co,Address not found,correo original aparece publicado pero reboto como inexistente,no reenviar por email; usar telefono/ext o busqueda manual adicional,"pmunozs@unal.edu.co; ext 16328",manual,https://www.humanas.unal.edu.co/2017/docentes/pablo-munoz-specht/perfil,La fuente publica conserva el mismo correo; el rebote sugiere dato obsoleto o cuenta no recibible.
